regulation_id,requirement_id,section_id,description,requirement_type,is_quantitative,applies_to_loan_type,severity
APS-112,APS-112-REQ-122,APS-112-ATT-G,"Eligible financial collateral under the simple approach includes debt securities rated by an ECAI with a credit rating grade of four or better for long-term sovereign securities, or three or better for short-term or long-term securities issued by other counterparties.",collateral,True,all,mandatory
APS-112,APS-112-REQ-123,APS-112-ATT-G,Senior securitisation exposures are eligible financial collateral under the simple approach only if they have an external credit rating grade of one.,collateral,True,all,mandatory
APS-112,APS-112-REQ-124,APS-112-ATT-G,"For unlisted trust units to qualify as eligible financial collateral under the simple approach, the ADI must be able to redeem its investment within three business days.",collateral,True,all,mandatory
APS-112,APS-112-REQ-101,APS-112-ATT-G-CONT-P41,"Where a maturity mismatch exists, collateral may only be recognised if the original maturity of the term of lodgement is at least 12 months and the residual maturity is at least 3 months.",collateral,True,all,mandatory
APS-112,APS-112-REQ-102,APS-112-ATT-G-CONT-P41,"Where a maturity mismatch exists, an ADI must apply the prescribed adjustment formula to the collateral value using the residual maturity of the collateral and the residual maturity of the exposure.",collateral,False,all,mandatory
APS-112,APS-112-REQ-103,APS-112-ATT-G-CONT-P41,An ADI must use the supervisory haircuts set out in Table 23 to determine haircuts for collateral and exposure items.,collateral,True,all,mandatory
APS-112,APS-112-REQ-104,APS-112-ATT-G-CONT-P41,"An ADI must apply a haircut of 8 per cent for currency risk where the exposure and collateral are denominated in different currencies, and zero per cent where they are in the same currency.",collateral,True,all,mandatory
APS-112,APS-112-REQ-105,APS-112-ATT-G-CONT-P41,"An ADI must apply the minimum holding periods and conditions in Table 24 to SFTs, other capital-market-driven transactions, and secured lending.",collateral,True,all,mandatory
APS-112,APS-112-REQ-106,APS-112-ATT-G-CONT-P41,"An ADI must apply a higher minimum holding period of 20 business days for netting sets where the number of trades exceeds 5,000 at any point during a quarter, for the following quarter.",collateral,True,all,mandatory
APS-112,APS-112-REQ-107,APS-112-ATT-G-CONT-P41,"An ADI must apply a minimum holding period of 20 business days for netting sets containing illiquid collateral or OTC derivatives that cannot be easily replaced, assessed under stressed market conditions.",collateral,True,all,mandatory
APS-112,APS-112-REQ-108,APS-112-ATT-G-CONT-P41,"If an ADI has experienced more than two margin call disputes on a netting set over the previous two quarters lasting longer than the applicable minimum holding period, it must use a minimum holding period at least double the supervisory floor for that netting set for the subsequent two quarters.",collateral,True,all,mandatory
APS-112,APS-112-REQ-109,APS-112-ATT-G-CONT-P41,An ADI must calculate the margining frequency adjustment factor for a transaction or netting set using the prescribed formula based on the minimum holding period and the number of business days between remarginings or revaluations.,collateral,False,all,mandatory
APS-112,APS-112-REQ-110,APS-112-ATT-G-CONT-P41,"For SFTs covered by an eligible bilateral netting agreement, an ADI using the comprehensive approach must calculate EAD using the prescribed formula incorporating net and gross exposures and currency haircuts.",capital,False,all,mandatory
APS-112,APS-112-REQ-111,APS-112-ATT-H,An ADI that chooses to net transactions must do so on a consistent basis and must apply netting to all transactions in both the banking book and trading book covered by a netting agreement.,governance,False,all,mandatory
APS-112,APS-112-REQ-112,APS-112-ATT-H,"An ADI that applies netting for Regulatory Capital purposes must have a netting policy that addresses the requirements in this Prudential Standard, including systems and controls for monitoring and reporting netted transactions and managing roll-off and termination risk.",governance,False,all,mandatory
APS-112,APS-112-REQ-113,APS-112-ATT-H,An ADI must maintain adequate records to support the application of the netting agreement.,monitoring,False,all,mandatory
APS-112,APS-112-REQ-114,APS-112-ATT-H,"For Regulatory Capital purposes, an ADI may only net on-balance sheet loans and deposits, SFTs, and OTC derivative transactions with a single counterparty; netting across derivatives and SFTs is not permitted.",capital,False,all,mandatory
APS-112,APS-112-REQ-115,APS-112-ATT-H,An ADI may only net internal transactions between the banking book and trading book if the transactions are marked-to-market daily and any collateralised instruments comply with eligible collateral criteria in Attachment G.,collateral,False,all,mandatory
APS-112,APS-112-REQ-116,APS-112-ATT-H,"An ADI may only use net exposures of loans and deposits as the basis for its RWA calculation where it satisfies all four conditions in paragraph 7, including legal enforceability, ability to identify netted positions, and monitoring of roll-off and net exposures.",capital,False,all,mandatory
APS-112,APS-112-REQ-117,APS-112-ATT-H,"An eligible bilateral netting agreement must meet all five criteria in paragraph 9, including close-out rights on default, single net amount settlement, prompt collateral liquidation, legal enforceability, and no walkaway clause.",governance,False,all,mandatory
APS-112,APS-112-REQ-118,APS-112-ATT-H,"To ensure legal enforceability of a netting agreement, an ADI must obtain a written and reasoned legal opinion confirming enforceability across all relevant jurisdictions and maintain policies to keep enforceability under review.",governance,False,all,mandatory
APS-112,APS-112-REQ-119,APS-112-ATT-H,"An ADI must not recognise a netting agreement for Regulatory Capital purposes if there is any doubt as to its legal enforceability, including where a foreign regulator has indicated netting is not enforceable under its laws.",capital,False,all,mandatory
APS-112,APS-112-REQ-120,APS-112-ATT-I,"Where an exposure is covered by a guarantee from an eligible guarantor, an ADI may substitute the risk weight of the guarantor for the counterparty for the covered portion; the uncovered portion must be risk-weighted at the original counterparty's risk weight.",capital,False,all,mandatory
APS-112,APS-112-REQ-121,APS-112-ATT-I,"To be recognised as eligible CRM, a guarantee must satisfy all seven minimum requirements in paragraph 2, including being a direct, explicit, irrevocable, unconditional claim on an eligible guarantor covering all payment types.",collateral,False,all,mandatory
APS-112,APS-112-REQ-122,APS-112-ATT-I,"An ADI must only recognise guarantees from sovereigns, banks, externally rated entities (for non-securitisation exposures), or entities with credit rating grade three or better (for securitisation exposures), and only where the guarantor has a lower risk weight than the counterparty.",collateral,False,all,mandatory
APS-112,APS-112-REQ-123,APS-112-ATT-I,"For securitisation exposures, eligible guarantors must have a credit rating grade of three or better and must have been externally rated two or better at the time the credit protection was provided.",collateral,True,all,mandatory
APS-112,APS-112-REQ-124,APS-112-ATT-I,"An indirect Australian Government guarantee may be treated as a direct guarantee provided the indirect guarantee covers all credit risk elements, both guarantees meet paragraph 2 requirements, and the ADI is satisfied the coverage is equivalent to a direct guarantee.",collateral,False,all,mandatory
APS-112,APS-112-REQ-125,APS-112-ATT-I,Letters of comfort do not qualify as eligible guarantees for CRM purposes.,collateral,False,all,mandatory
APS-112,APS-112-REQ-126,APS-112-ATT-I,"Where a guarantee includes a materiality threshold on payments below which no payment will be made in the event of loss, it is equivalent to a retained first loss position and must be deducted from Common Equity Tier 1 Capital in accordance with APS 111, capped at the capital required against the full exposure.",capital,False,all,mandatory
APS-112,APS-112-REQ-127,APS-112-ATT-I,"Where there is partial coverage of an exposure by a guarantee and the covered and uncovered portions are of equal seniority, capital relief will be afforded on a proportional basis.",capital,False,all,mandatory
APS-112,APS-112-REQ-101,APS-112-ATT-I-CURRENCY,"Where a guarantee has a currency mismatch, the ADI must reduce the protected amount by applying a haircut of 8 per cent based on a 10 business day holding period and daily marking-to-market, adjusted for actual revaluation frequency.",capital,True,all,mandatory
APS-112,APS-112-REQ-102,APS-112-ATT-I-MATURITY,A guarantee with a maturity mismatch is only eligible CRM if its original maturity is at least 12 months and its residual maturity is at least 3 months.,collateral,True,all,mandatory
APS-112,APS-112-REQ-103,APS-112-ATT-I-MATURITY,"Where credit protection from a single guarantor on the same exposure has different maturities, the ADI must divide the exposure into separate covered portions for risk-weighting purposes.",capital,False,all,mandatory
APS-112,APS-112-REQ-104,APS-112-ATT-I-MATURITY,"Where there is a maturity mismatch on a guarantee, the ADI must apply the prescribed maturity adjustment formula using the residual maturity of the guarantee and the exposure.",capital,False,all,mandatory
APS-112,APS-112-REQ-105,APS-112-ATT-J-PURCHASED,An ADI purchasing credit protection through an eligible credit derivative may substitute the risk weight of the protection seller for the covered portion of the exposure; the uncovered portion retains the original counterparty risk weight.,capital,False,all,mandatory
APS-112,APS-112-REQ-106,APS-112-ATT-J-PURCHASED,Eligible credit derivatives for CRM purposes are limited to single-name credit-default swaps and certain total-rate-of-return swaps; a total-rate-of-return swap where net payments are recorded as income without offsetting asset deterioration must not be recognised.,collateral,False,all,mandatory
APS-112,APS-112-REQ-107,APS-112-ATT-J-MINREQ,"A credit derivative must meet all structural minimum requirements including being a direct claim, explicitly referenced, irrevocable, unconditional, and specifying minimum credit events including failure to pay, bankruptcy, and restructuring.",collateral,False,all,mandatory
APS-112,APS-112-REQ-108,APS-112-ATT-J-MINREQ,"Where restructuring is excluded from the credit derivative contract but all other minimum requirements are met, an ADI may only recognise 60 per cent of the lesser of the credit protection amount and the underlying exposure amount.",capital,True,all,mandatory
APS-112,APS-112-REQ-109,APS-112-ATT-J-ELIGPROV,"An ADI must only recognise credit protection from sovereigns, banks, externally rated entities for non-securitisation exposures, and for securitisation exposures, entities rated grade three or better that were rated grade two or better at the time protection was provided.",collateral,True,all,mandatory
APS-112,APS-112-REQ-110,APS-112-ATT-J-MATTHRESH,"A credit derivative with a materiality threshold on payments is treated as a retained first loss position and must be deducted from Common Equity Tier 1 Capital, capped at the capital required for the full underlying exposure.",capital,False,all,mandatory
APS-112,APS-112-REQ-111,APS-112-ATT-J-MATTHRESH,Partial credit derivative coverage of equal seniority receives proportional capital relief; partial coverage with seniority differences is treated as a synthetic securitisation subject to APS 120.,capital,False,all,mandatory
APS-112,APS-112-REQ-112,APS-112-ATT-J-CURRENCY,"Where a credit derivative has a currency mismatch, the ADI must reduce the protected amount by applying an 8 per cent haircut based on a 10 business day holding period and daily marking-to-market, adjusted for actual revaluation frequency.",capital,True,all,mandatory
APS-112,APS-112-REQ-113,APS-112-ATT-J-MATURITY,A credit derivative with a maturity mismatch is only eligible CRM if its original maturity is at least 12 months and its residual maturity is at least 3 months.,collateral,True,all,mandatory
APS-112,APS-112-REQ-114,APS-112-ATT-J-MATURITY,"Where there is a maturity mismatch on a credit derivative, the ADI must apply the prescribed maturity adjustment formula using the residual maturity of the credit derivative and the underlying exposure.",capital,False,all,mandatory
APS-112,APS-112-REQ-115,APS-112-ATT-J-SOLD,"An ADI selling credit protection must undertake a written Regulatory Capital assessment prior to execution, notify APRA, and apply that assessment unless APRA determines an alternative methodology.",governance,False,all,mandatory
APS-112,APS-112-REQ-116,APS-112-ATT-J-SOLD,"An ADI selling credit protection must assume 100 per cent of the credit risk is purchased for capital adequacy purposes, irrespective of the range of specified credit events.",capital,True,all,mandatory
APS-112,APS-112-REQ-117,APS-112-ATT-J-SOLD,An ADI selling credit protection via a credit derivative with an embedded extension option must assume the longest possible effective maturity regardless of contractual incentives to reduce the term.,capital,False,all,mandatory
APS-112,APS-112-REQ-118,APS-112-ATT-J-SOLD,"When determining the amount of credit protection sold, an ADI must assume that any materiality thresholds in the credit derivative contract do not reduce the acquired credit risk.",capital,False,all,mandatory
APS-112,APS-112-REQ-119,APS-112-ATT-J-CDS,"For credit protection sold via a single-name credit-default swap, the ADI must apply the risk weight of the reference entity to the maximum possible payable amount under the contract.",capital,False,all,mandatory
APS-112,APS-112-REQ-120,APS-112-ATT-J-CDS,"For first-to-default basket credit derivatives, risk weights of all basket assets must be aggregated up to a maximum of 1250 per cent and multiplied by the nominal protection amount to obtain the risk-weighted asset amount.",capital,True,all,mandatory
APS-112,APS-112-REQ-121,APS-112-ATT-J-CDS,"For second-to-default basket credit derivatives, the treatment is the same as first-to-default except the asset with the lowest risk-weighted amount may be excluded from the aggregation; for nth-to-default, the n assets with the lowest risk-weighted amounts may be excluded.",capital,True,all,mandatory
